question,answer
How do I open a new checking account?,You can open an account online in minutes. We will ask for your personal information, valid ID, and initial deposit.
What are overdraft fees and how do I avoid them?,Overdraft fees are charged when a transaction exceeds your available balance. You can avoid overdrafts by enabling balance alerts, linking a savings account for overdraft protection, or declining overdraft coverage.
How can I dispute a transaction?,You can file a dispute in the mobile app or call customer support. We will investigate and temporarily credit your account if needed.
How quickly do mobile check deposits clear?,Most mobile deposits clear within 1–2 business days; larger or unusual items may take longer for verification.
How do I reset my online banking password?,Use the 'Forgot Password' option on the sign-in screen. You will be prompted to verify your identity.
